{
  "type": "er",
  "caption": "Order rows",
  "legend": {
    "main": "Main path",
    "branch": "Alternative"
  },
  "entities": [
    {
      "id": "a",
      "label": "Order",
      "fields": [
        {
          "name": "id",
          "type": "uuid",
          "key": "pk"
        },
        {
          "name": "user_id",
          "type": "uuid",
          "key": "fk"
        }
      ]
    }
  ],
  "relations": []
}
